{
  "schema_version": "spec_ir/1",
  "case_id": "source_verified__official_idaes_sofc_soec_coproduction",
  "family": "family_official_idaes_sofc_soec_coproduction",
  "source_url": "https://github.com/IDAES/examples-pse/blob/b9606eeddf24ddcb24b27eabe84a911d148abc93/src/Examples/Flowsheets/power_generation/sofc_soec/sofc_with_soec.py",
  "topology_schema_version": "topology_ir/1",
  "specs": [],
  "terminal_feed_ports": [],
  "terminal_product_ports": [],
  "translator_constraint_templates": {},
  "initialization": {},
  "solve": {}
}
